{
  "$schema": "https://json-schema.org/draft/2020-12/schema",
  "$id": "https://github.com/bradwmorris/centaur-context/contract/context-contract.schema.json",
  "title": "Centaur Context contract",
  "type": "object",
  "additionalProperties": false,
  "required": [
    "$schema",
    "contract_version",
    "ontology_version",
    "tool_version",
    "object_types",
    "connection_kinds",
    "description_policy",
    "tools",
    "limits",
    "rules"
  ],
  "properties": {
    "$schema": {
      "const": "https://json-schema.org/draft/2020-12/schema"
    },
    "contract_version": {
      "type": "string",
      "pattern": "^[0-9]+\\.[0-9]+\\.[0-9]+$"
    },
    "ontology_version": {
      "type": "string",
      "minLength": 1
    },
    "tool_version": {
      "type": "string",
      "pattern": "^[0-9]+\\.[0-9]+\\.[0-9]+$"
    },
    "object_types": {
      "type": "object",
      "minProperties": 1,
      "additionalProperties": {
        "type": "object",
        "additionalProperties": false,
        "required": [
          "interactive_write",
          "fields"
        ],
        "properties": {
          "interactive_write": {
            "type": "boolean"
          },
          "creation_requirements": {
            "type": "string"
          },
          "fields": {
            "type": "array",
            "items": {
              "type": "string"
            },
            "uniqueItems": true
          }
        }
      }
    },
    "connection_kinds": {
      "type": "array",
      "minItems": 1,
      "items": {
        "type": "string"
      },
      "uniqueItems": true
    },
    "description_policy": {
      "type": "object",
      "additionalProperties": false,
      "required": [
        "max_characters",
        "preferred_sentences",
        "current_snapshot_not_log",
        "refresh_when_materially_stale",
        "guidance",
        "examples"
      ],
      "properties": {
        "max_characters": {
          "type": "integer",
          "minimum": 1
        },
        "preferred_sentences": {
          "type": "integer",
          "minimum": 1
        },
        "current_snapshot_not_log": {
          "const": true
        },
        "refresh_when_materially_stale": {
          "const": true
        },
        "guidance": {
          "type": "array",
          "minItems": 1,
          "items": {
            "type": "string",
            "minLength": 1
          },
          "uniqueItems": true
        },
        "examples": {
          "type": "object",
          "additionalProperties": false,
          "required": [
            "task",
            "entity",
            "source",
            "note",
            "theme",
            "chat",
            "user",
            "memory",
            "event"
          ],
          "properties": {
            "task": {
              "type": "string",
              "minLength": 1
            },
            "entity": {
              "type": "string",
              "minLength": 1
            },
            "source": {
              "type": "string",
              "minLength": 1
            },
            "note": {
              "type": "string",
              "minLength": 1
            },
            "theme": {
              "type": "string",
              "minLength": 1
            },
            "chat": {
              "type": "string",
              "minLength": 1
            },
            "user": {
              "type": "string",
              "minLength": 1
            },
            "memory": {
              "type": "string",
              "minLength": 1
            },
            "event": {
              "type": "string",
              "minLength": 1
            }
          }
        }
      }
    },
    "tools": {
      "type": "object",
      "additionalProperties": false,
      "required": [
        "context_search",
        "context_read",
        "context_apply"
      ],
      "properties": {
        "context_search": {
          "$ref": "#/$defs/tool"
        },
        "context_read": {
          "$ref": "#/$defs/tool"
        },
        "context_apply": {
          "$ref": "#/$defs/tool"
        }
      }
    },
    "limits": {
      "type": "object",
      "additionalProperties": {
        "type": "integer",
        "minimum": 1
      }
    },
    "rules": {
      "type": "object",
      "properties": {
        "standalone_note_intents": {
          "type": "array",
          "items": {
            "type": "string",
            "enum": [
              "idea",
              "fact",
              "insight",
              "question"
            ]
          }
        }
      },
      "additionalProperties": {
        "type": "boolean"
      }
    },
    "ontology_guide": {
      "type": "object"
    }
  },
  "$defs": {
    "tool": {
      "type": "object",
      "additionalProperties": false,
      "required": [
        "operation",
        "read_only",
        "input",
        "output"
      ],
      "properties": {
        "operation": {
          "type": "string",
          "minLength": 1
        },
        "read_only": {
          "type": "boolean"
        },
        "idempotent": {
          "type": "boolean"
        },
        "input": {
          "$ref": "#/$defs/shape"
        },
        "task_filters": {
          "$ref": "#/$defs/shape"
        },
        "operations": {
          "type": "object",
          "minProperties": 1,
          "additionalProperties": {
            "$ref": "#/$defs/shape"
          }
        },
        "object_reference": {
          "type": "object",
          "additionalProperties": false,
          "required": [
            "exactly_one_of"
          ],
          "properties": {
            "exactly_one_of": {
              "type": "array",
              "minItems": 2,
              "items": {
                "type": "string"
              },
              "uniqueItems": true
            }
          }
        },
        "output": {
          "$ref": "#/$defs/shape"
        },
        "entity_filters": {
          "$ref": "#/$defs/shape"
        }
      }
    },
    "shape": {
      "type": "object",
      "additionalProperties": false,
      "required": [
        "required"
      ],
      "properties": {
        "required": {
          "type": "array",
          "items": {
            "type": "string"
          },
          "uniqueItems": true
        },
        "optional": {
          "type": "array",
          "items": {
            "type": "string"
          },
          "uniqueItems": true
        }
      }
    }
  }
}
